{
  "$schema": "./frontier.schema.json",
  "schemaVersion": 1,
  "status": "prototype",
  "asOfCommit": "1697404",
  "leasePolicy": {
    "defaultHours": 72,
    "activationBoundary": "merged-to-main",
    "unmergedReservationIsExclusive": false
  },
  "frontiers": [
    {
      "id": "FR-0001",
      "title": "Complete frozen native-MTP 32-token category holdouts",
      "state": "open",
      "question": "Do the ordinary-text PW-0216 gains survive the already-frozen code, multilingual, and rare-route holdouts?",
      "whyItMatters": "This determines whether the strongest complete-path gain broadens beyond its first untouched slice.",
      "dependsOn": ["PW-0215", "PW-0216"],
      "establishedBy": ["PW-0216"],
      "killedBy": [],
      "cheapFalsifier": "Run the frozen remaining holdouts under the PW-0216 protocol without changing prompts, thresholds, or arithmetic.",
      "requiredAuthority": ["frozen prompt hashes", "pinned checkpoint", "verifier-authorized output parity"],
      "redLines": ["no holdout tuning", "accepted tokens only", "complete-path timing"],
      "lease": null
    },
    {
      "id": "FR-0002",
      "title": "Reduce native proposer embodiment cost",
      "state": "open",
      "question": "Can proposal generation become materially cheaper while the source-checkpoint verifier remains the sole commit authority?",
      "whyItMatters": "PW-0216 shows useful speculation, but proposal cost and verifier/storage traffic remain far from the 50 TPS target.",
      "dependsOn": ["PW-0208", "PW-0214", "PW-0215", "PW-0216"],
      "establishedBy": ["PW-0215", "PW-0216"],
      "killedBy": ["PW-0214"],
      "cheapFalsifier": "Predeclare one embodiment mechanism and measure its isolated proposal cost before a complete interleaved candidate/control run.",
      "requiredAuthority": ["native MTP weights", "verifier-only commit", "complete wall-time manifest"],
      "redLines": ["draft approximation must not commit output", "no proposed-token TPS"],
      "lease": null
    },
    {
      "id": "FR-0003",
      "title": "Attack dominant prefill and storage traffic",
      "state": "open",
      "question": "Which mechanism can remove dominant full-path bytes or stalls after recent prefetch, transport, and packed-domain controls?",
      "whyItMatters": "Current text delivery remains orders of magnitude below target and storage/prefill costs dominate several measured cuts.",
      "dependsOn": ["PW-0209", "PW-0210", "PW-0212", "PW-0213"],
      "establishedBy": ["PW-0209", "PW-0213"],
      "killedBy": ["PW-0210", "PW-0212"],
      "cheapFalsifier": "Show that a named mechanism can affect a nontrivial share of complete wall time before implementing a new runtime path.",
      "requiredAuthority": ["cold/warm distinction", "measured bytes", "complete-path attribution"],
      "redLines": ["no theoretical bandwidth as achieved TPS", "no hidden cache warming"],
      "lease": null
    },
    {
      "id": "FR-0004",
      "title": "Close accumulated parity and native modality gaps",
      "state": "open",
      "question": "Can the bounded causal path pass accumulated hosted-reference parity and extend through native image, audio, video, and mixed inputs?",
      "whyItMatters": "Full-capability near-equivalence is a completion gate independent of text throughput.",
      "dependsOn": [],
      "establishedBy": [],
      "killedBy": [],
      "cheapFalsifier": "Add the next missing layer-local or modality fixture and stop on the first unexplained mismatch in the correctness ladder.",
      "requiredAuthority": ["pinned processor and checkpoint", "source-derived fixture", "hosted epoch where applicable"],
      "redLines": ["no text surrogate for native media", "no parity claim without required logprobs"],
      "lease": null
    },
    {
      "id": "FR-0005",
      "title": "Find a weight representation mechanism beyond the audited controls",
      "state": "open",
      "question": "Is there a new representation mechanism that reduces executable traffic while surviving source-faithful and real-query controls?",
      "whyItMatters": "The routed bank dominates capacity and traffic, but recent equal-budget candidates failed their fidelity or work gates.",
      "dependsOn": ["PW-0300", "PW-0301", "PW-0302", "PW-0303", "PW-0304"],
      "establishedBy": ["PW-0300"],
      "killedBy": ["PW-0301", "PW-0302", "PW-0303", "PW-0304"],
      "cheapFalsifier": "State the premise changed relative to PW-0300--PW-0304 and test it on a real-query, equal-traffic control before training or kernel work.",
      "requiredAuthority": ["source FP8 semantics", "real routed queries", "equal executable-traffic accounting"],
      "redLines": ["no parameter-MSE-only promotion", "modified weights must be named modified"],
      "lease": null
    }
  ]
}
